<?xml version="1.0" encoding="UTF-8"?>
<!ELEMENT poema (titulo, autor, corpo, data) >
<!ELEMENT titulo (#PCDATA) >
<!ELEMENT autor (#PCDATA) >
<!ELEMENT data (#PCDATA) >

<!ELEMENT corpo (estrofe+) >
<!ELEMENT estrofe (verso+) >

<!ELEMENT verso (#PCDATA | nome | local)* >
<!ELEMENT nome (#PCDATA) >
<!ELEMENT local (#PCDATA) >