<?xml version="1.0" encoding="UTF-8"?>
<!DOCTYPE poema SYSTEM "file:/C:/Users/Octavio/Documents/GitHub/PLC_PRI/Aulas/Aula2/poema.dtd">
<poema>
    <titulo>Soneto JÃ¡ Antigo</titulo>
    <autor></autor>
    <corpo>
        <estrofe>
            <verso>dasdasd <nome>RUI</nome> d31239123</verso>
        </estrofe>
    </corpo>
    <data></data>
</poema>